{
  "cluster_session":"5116A3CE974643D6",
  "players":{
    "KU_SXC71LDz":{
      "current_shard":"1",
      "achievements":{
        "Social/firstdeath":{
          "title":"Welcome!",
          "unlocked_irl":1782048658,
          "day":6
        },
        "Time/firstnight":{
          "title":"The Beginning",
          "unlocked_irl":1782045870,
          "day":2
        },
        "Activity/eyebrella":{
          "title":"Eye To The Sky!",
          "unlocked_irl":1782045881,
          "day":2
        },
        "Social/equipall":{
          "title":"Matching Attire",
          "unlocked_irl":1782045826,
          "day":1
        }
      },
      "achievements_count":4,
      "days_survived":3,
      "klei_id":"KU_SXC71LDz",
      "last_seen_irl":1782640552,
      "prefab":"wilson",
      "online":true,
      "progress":{
        "Social/sixplayers":1,
        "Time/fivehundred":3,
        "Time/thirtyfive":3,
        "Time/onehundred":3,
        "Mastery/alltrophy":4,
        "Mastery/alltime":1,
        "Time/twenty":3,
        "Time/fiftyfive":3,
        "Social/samecharacter":1,
        "Mastery/allactivity":1,
        "Combat/hound":1,
        "Time/onethousand":3,
        "Mastery/allsocial":2,
        "Social/tendeath":1
      },
      "name":"ヒナタ"
    }
  },
  "schema_version":2,
  "catalog":{
    "Activity/krampus":{
      "title":"You've Been Naughty",
      "goal":1
    },
    "Character/wanda2":{
      "title":"Timewinder",
      "goal":40
    },
    "Combat/rocky":{
      "title":"It's Not A Rock!",
      "goal":5
    },
    "Mastery/allboss":{
      "title":"Slayer of Worlds",
      "goal":38
    },
    "Mastery/alltime":{
      "title":"Time Is a Prison",
      "goal":10
    },
    "Character/wx781":{
      "title":"FIRE UP AND READY TO SERVE",
      "goal":23
    },
    "Activity/opalstaff":{
      "title":"Corrupted by The Moon",
      "goal":1
    },
    "Social/litflare":{
      "title":"Lights On The Sky",
      "goal":1
    },
    "Boss/daywalker2":{
      "title":"Junk Hoarder",
      "goal":1
    },
    "Activity/smallbird":{
      "title":"Not Your Momma",
      "goal":1
    },
    "Character/wonkey2":{
      "title":"Jack's Run",
      "goal":1
    },
    "Exploration/vaultbiome":{
      "title":"Forgotten Halls",
      "goal":1
    },
    "Combat/shadowscythe":{
      "title":"Dark Harvest",
      "goal":20
    },
    "Time/firstnight":{
      "title":"The Beginning",
      "goal":1
    },
    "Activity/antlionhat":{
      "title":"The Terraformer",
      "goal":100
    },
    "Activity/onehp":{
      "title":"Not Even Close, Baby!",
      "goal":1
    },
    "Mastery/allexploration":{
      "title":"True Explorer",
      "goal":20
    },
    "Character/wendy1":{
      "title":"Casper Meets Wendy",
      "goal":10
    },
    "Activity/dummytarget":{
      "title":"They're All Dummies",
      "goal":1
    },
    "Character/waxwell1":{
      "title":"Nightmare Extractor",
      "goal":10
    },
    "Activity/allrelic":{
      "title":"Relic Collector",
      "goal":6
    },
    "Activity/bushhat":{
      "title":"Hide On Bush",
      "goal":1
    },
    "Character/wilson1":{
      "title":"The Chosen One",
      "goal":1
    },
    "Boss/alterguardianscion":{
      "title":"Celestial Abomination",
      "goal":1
    },
    "Character/wickerbottom2":{
      "title":"Knowledge Is Power!",
      "goal":17
    },
    "Activity/eyeturret":{
      "title":"Impenetrable Defense",
      "goal":1
    },
    "Character/wolfgang1":{
      "title":"I am Mighty!",
      "goal":1
    },
    "Hunt/spat":{
      "title":"Tempering Steel",
      "goal":1
    },
    "Activity/shavebeefalo":{
      "title":"Haircutter",
      "goal":1
    },
    "Combat/bunnyman":{
      "title":"Hop! Hop! Hop!",
      "goal":40
    },
    "Hunt/koalefantwinter":{
      "title":"It's Cold Outside",
      "goal":1
    },
    "Boss/alterguardian":{
      "title":"Celestial Onslaught",
      "goal":1
    },
    "Boss/antlion":{
      "title":"Ant Fodder",
      "goal":1
    },
    "Activity/wormhole":{
      "title":"Worming My Way In",
      "goal":1
    },
    "Character/wortox1":{
      "title":"Dodge This!",
      "goal":1
    },
    "Boss/vaultguard":{
      "title":"Towering Defense",
      "goal":1
    },
    "Hunt/lightninggoat":{
      "title":"Lightning Bluff",
      "goal":1
    },
    "Character/winona2":{
      "title":"I Know Your Moves!",
      "goal":5
    },
    "Activity/prestihati":{
      "title":"Hat Trick",
      "goal":1
    },
    "Exploration/deciduousbiome":{
      "title":"Birchnutter",
      "goal":1
    },
    "Boss/moondeerclops":{
      "title":"Crystalized",
      "goal":1
    },
    "Activity/megaflare":{
      "title":"Keep 'em Coming!",
      "goal":1
    },
    "Exploration/mushroombiome":{
      "title":"Mushroom Kingdom",
      "goal":1
    },
    "Combat/shark":{
      "title":"Maneater",
      "goal":1
    },
    "Combat/pigman":{
      "title":"Slaughterhouse",
      "goal":40
    },
    "Hunt/gingerbreadwarg":{
      "title":"Bittersweet",
      "goal":1
    },
    "Exploration/cavesbiome":{
      "title":"To the Mines!",
      "goal":1
    },
    "Exploration/shadowriftbiome":{
      "title":"Terrors From Below",
      "goal":1
    },
    "Social/reviveplayer":{
      "title":"A Giving Heart",
      "goal":1
    },
    "Boss/rabbitking":{
      "title":"No Meat Allowed",
      "goal":1
    },
    "Mastery/allfarming":{
      "title":"Sit and Relax",
      "goal":7
    },
    "Character/wickerbottom1":{
      "title":"Bookworm",
      "goal":40
    },
    "Character/waxwell2":{
      "title":"Prison Officer",
      "goal":40
    },
    "Activity/allweapon":{
      "title":"Warmaster",
      "goal":32
    },
    "Activity/shadowaxe":{
      "title":"Killing Spree",
      "goal":1
    },
    "Exploration/ventbiome":{
      "title":"Volcanic Venture",
      "goal":1
    },
    "Activity/greenamulet":{
      "title":"50% OFF!",
      "goal":1
    },
    "Activity/potatocup":{
      "title":"There Are Some Who Call Him...",
      "goal":1
    },
    "Time/fiftyfive":{
      "title":"I Will Survive",
      "goal":55
    },
    "Combat/worm":{
      "title":"Worms Armageddon",
      "goal":50
    },
    "Boss/spiderqueen":{
      "title":"Insecticide Regicide",
      "goal":1
    },
    "Boss/deerclopsyule":{
      "title":"I See Red",
      "goal":1
    },
    "Boss/lordfruitfly":{
      "title":"Bugbusters",
      "goal":1
    },
    "Activity/shellblock":{
      "title":"Defensive Strike",
      "goal":1
    },
    "Boss/dragonfly":{
      "title":"No Fly Zone",
      "goal":1
    },
    "Activity/lunarforge":{
      "title":"The Celestial Forge",
      "goal":1
    },
    "Activity/jimbo":{
      "title":"High Stakes",
      "goal":600
    },
    "Social/sixplayers":{
      "title":"We Play Together, We Die Together!",
      "goal":6
    },
    "Boss/moonbearger":{
      "title":"Tank Sweep",
      "goal":1
    },
    "Exploration/monkeybiome":{
      "title":"Monkey Paradise",
      "goal":1
    },
    "Boss/sharkboi":{
      "title":"Frostbite",
      "goal":1
    },
    "Activity/deerclopssentry":{
      "title":"Chilling Aura",
      "goal":1
    },
    "Character/willow2":{
      "title":"This Is Fine",
      "goal":1
    },
    "Combat/brightshadepipe":{
      "title":"Lunar Barrage",
      "goal":20
    },
    "Character/wolfgang2":{
      "title":"Empty Stomach",
      "goal":40
    },
    "Time/twenty":{
      "title":"Not Dead Yet",
      "goal":20
    },
    "Boss/wagbossrobot":{
      "title":"Sweet Smell of Science",
      "goal":1
    },
    "Character/wathgrithr1":{
      "title":"Valhalla Combatant",
      "goal":20
    },
    "Character/winona1":{
      "title":"FLEX TAPE!",
      "goal":40
    },
    "Activity/heavyfish":{
      "title":"Off The Scales",
      "goal":1
    },
    "Time/sailor":{
      "title":"Pleasure Cruise",
      "goal":1
    },
    "Mastery/allsocial":{
      "title":"Social Celebrity",
      "goal":14
    },
    "Hunt/warg":{
      "title":"Big Puppy",
      "goal":1
    },
    "Boss/stalkercave":{
      "title":"It's Not A Fossil!",
      "goal":1
    },
    "Activity/beecrown":{
      "title":"My Liege!",
      "goal":1
    },
    "Boss/twinsofterror":{
      "title":"Ophthalmologist",
      "goal":1
    },
    "Boss/alterguardian2":{
      "title":"Rematch!",
      "goal":1
    },
    "Activity/wardrobe":{
      "title":"Fashion Week",
      "goal":1
    },
    "Character/wurt1":{
      "title":"Once Upon a Time...",
      "goal":17
    },
    "Activity/dbeefalo":{
      "title":"Beast of the Bottomless Stomach",
      "goal":1
    },
    "Boss/malbatross":{
      "title":"Waterfowl Hunting",
      "goal":1
    },
    "Character/willow1":{
      "title":"Inflammable",
      "goal":40
    },
    "Character/wanda1":{
      "title":"Twisted Tempo",
      "goal":1
    },
    "Character/wendy2":{
      "title":"Battle Sisters",
      "goal":40
    },
    "Social/giveplayer":{
      "title":"It's Dangerous To Go Alone!",
      "goal":1
    },
    "Combat/hound":{
      "title":"The Houndmaster",
      "goal":100
    },
    "Activity/hutch2":{
      "title":"Thornmail",
      "goal":1
    },
    "Combat/ghost":{
      "title":"Phasmophobia",
      "goal":1
    },
    "Activity/starvation":{
      "title":"Don't Starve",
      "goal":1
    },
    "Farming/tilling2":{
      "title":"It's Honest Work",
      "goal":400
    },
    "Farming/growcrop":{
      "title":"Plant Caretaker",
      "goal":1
    },
    "Exploration/ruinsbiome":{
      "title":"Ruins Raider",
      "goal":1
    },
    "Activity/rabbitkingtrade":{
      "title":"Wonderland",
      "goal":1
    },
    "Activity/fastfish":{
      "title":"Fast and Fishious",
      "goal":1
    },
    "Exploration/archivesbiome":{
      "title":"Forbidden Knowledge",
      "goal":1
    },
    "Activity/beargervest":{
      "title":"Hibearnation Season",
      "goal":1
    },